question_id,question_text
5ae544d75542990ba0bbb249, Arena Essex Raceway is built alongside an out-of-town shopping centre constructed on the site of a former what?
5abbaed855429931dba144aa,What day in November is Southpark most congested?
5adfb698554299603e418385,Who created the manga series originally serialized from 1994-1995with a superheroine?
5ab1dcab5542993be8fa985e,"What was the middle name of the actress who was cast alongside Harvey Fierstein, Linda Hart, Dick Latessa, Clarke Thorell, Mary Bond Davis, Laura Bell Bundy, Matthew Morrison, Corey Reynolds, and Marissa Jaret Winokur in Hairspray?"
5a7f404a55429930675136dd,Shepard Settlement is just south of what major New York city?
5ab60aec554299110f2199c3,What type of writing did both Richard Harding Davis and Harry Stephen Keeler write?
5a8f93f5554299458435d67e,"The name od the Jason Hook album ""Safety Dunce"" is a play on the words of a song released in what year? "
5adec96e5542995534e8c712,What ranks does Jerry Kyd wear while captaining the largest warship ever built for the Royal Navy?
5a77691455429966f1a36d2b,What movement is this music seen as that released Facta Loquuntur as their first full length album?
5a774e415542994aec3b7280,Who fills in occasionally for the meteorologist who replaced  Ginger Zee ?
5adbe2c65542996e68525274,In what corner of Missouri is radio station WMBH located?
5ab2342a5542993be8fa98c3, The Alexander Dawson School is located in a community that occupies how many acres ?
5abb07ec5542996cc5e49f55,The General Survey Act was passed shortly after the Supreme Court decision that discussed what concept?
5a81c7d15542990a1d231ea9,Which services did Rock Nominees Ltd and  ISS A/S (Integrated Service Solutions) have in common?
5ae1338d55429901ffe4ade1,The alcoholic drink that shares a name with Quintessentially Unreal's 1996 album is commonly reffered to in historical literature as what?
5ae65b845542992ae0d162f1,Where in the northernmost and largest freguesia can we find the Communications Museum?
5ae2138c5542997283cd23b7,Are Villa Paletti and Betrayal at House on the Hill both board games?
5a7e3b585542995ed0d166df,"Which film was released first, Home on the Range or Pete's Dragon?"
5ab4774d5542991751b4d781,Crash is similar to what 16th century British card game in the sense that there is no betting?
5ae690b055429908198fa622,Jamell Anderson plays for the basketball team from what city?
5a7299e75542991f9a20c524,"What movie was released at a later date, My Dog Tulip or Monsters vs. Aliens?"
5abb4b4a5542993f40c73aea,"Which university, attended by Jonas Tilly, is part of California's three-system public higher education plan?"
5abe36745542991f66106101,"What was the arena, in which the 2017 Brit Awards were held, called during the 2012 Olympics ?"
5abe765a55429976d4830b1f,Who has won more olympic medals: Angelique Kerber or Amélie Mauresmo?
5ac31b0a554299741d48a1f0,"Who directed the film to which "" A Perfect Murder"" was a modern remake? "
5ae6479a55429929b0807b1b,Jun Ji-hyun rose to fame after her as a girl in a film that's title means what?
5ac2cfab554299657fa29079,The Innocents is a 1961 gothic horror film that was based on a novella by Henry James published in what year?
5a7c64bc5542996dd594b913,"Who is older, Simon Neil or Michael McKean?"
5ade27e05542997c77aded7d,When was the friends song was released which is taken from the fourth studio album of canadian singer and song writer Justin Bieber?
5adfa6c7554299025d62a326,What is the birthday of the Earl of Merioneth?
5ae361805542992e3233c3c9,"What university did the last Detroit Pistons player to wear the number retired in honor of a player nicknamed ""The Worm"" attend?"
5add870b5542995b365fab3c,"Which actor starred in both ""The Best Years of Our Lives"" in 1946 and ""The Crowded Sky"" in 1960?"
5ab84f2c55429934fafe6d54,The Red Queen's Race is a science fiction short story that uses the Red Queen's race from a novel by Lewis Carroll that is the sequel to what?
5a8ee2855542995a26add550,Eusebio Valli studied alongside a physician who was the pioneer of what field?
5abeb3525542993fe9a41d03,Which community did Otto Gross join which includes the popular destination Monte Verita?
5a739d8c55429905862fe073,"Near which town did the family of author of the ""Adventures of Huckleberry Finn"" own several tracts of land?"
5abc715f5542993a06baf8ea,which Soviet Russian cellist.did Anton Ginsburg work best known as accompany 
5a7e21165542995ed0d166a2,"Who is younger, Billy Idol or Ray Wilson?"
5ae473545542995dadf2433d,When was the writer of Seesaw born? 
5a7a47be5542994f819ef1b2,Near the banks of what river is the city in Romania with a partner Aspen Institute located?
5abc8d00554299700f9d78fd,Matthew Butturini was born in a town on the Tweed River how many km north-east of Sydney?
5ab1c6c5554299722f9b4c67,"Boulevardier and Earthquake are cocktails, one of which has a french nickname of what?"
5ab42ef55542991751b4d6d9,"The actor who plays the grown version of Emma Swan's son, from ""Once Upon a Time"", also plays what character in the television show ""The Walking Dead""?"
5ae0968955429924de1b7105,When was the rock band to which Pre-Creedence name was changed active? 
5adefe645542992d7e9f926c,Which tour did The Beatles release their album Dark Horse?
5a82edae55429966c78a6a9f,"Swiss music duo Double released their best known single ""The Captain of Her Heart"" in what year?"
5abd68b45542993062266c77,What did the main character in Unbroken do in the Olympics?
5a7345185542992359bc32cb,"Which continent are both magazines, Sayidaty and Closer published?"
5adde6535542990dbb2f7ef9,"Which documentary was filmed first, Almost Sunrise or Hail! Hail! Rock 'n' Roll?"
5ae20cd25542997283cd2376,Gary L. Bennett was a part of the space missions that have a primary destination of what celestial body?
5a7da3a95542990b8f5039e6,What position did the former Major League Baseball player play who worked on the same broadcast team as Kim Kelch?
5ac2c22e5542990b17b15485,The Fort Worth Zoo was rated as one of the top zoos by a magazine published where? 
5ae4d3a55542990ba0bbb164,What creature of American folklore gained notoriety in 1964?
5ac19f405542991316484b5b,Pandikona and Berger Blanc Suisse are both what kinds of animals?
5ac00278554299012d1db56b,What profession do Raj Kapoor and Mike Cahill share?
5a7d2ecc5542995ed0d16629,Robbie Tucker plays in what series that follows a group of friends who run an Irish bar?
5abd5a135542992ac4f3829f,Are the Sleepers located north or south of the Kancamagus Highway?
5ab8f33155429919ba4e237f,"Illmatic, the debut studio album by Nas which featured the song ""N.Y. State of Mind"", was released on what date by which record label?"
5a7f57a45542992097ad2f29,"What party was Johan Henrik Deuntzer a part of before the party that translates to the ""Radical Left?"""
5a859a755542992a431d1b6d,"Who was considered more iconic, Charlie Chaplin or Bruce Bilson?"
5ab4304a55429942dd415ec5,To where did the war criminal who is the fictional defendant in the film After the Truth flee in real life ?
5a79257b55429974737f79a7,What military formation were participated in by both Oscar W. Koch and General George Smith Patton Jr. ?
5ac1767a5542994d76dcce48,What is the 2010 census population of the county where Wildcat Brook flows through Jackson?
5ae608f2554299546bf83026,Which system of mountains in eastern North America is Hamburg Mountains a range region of
5ab2979c554299449642c919,"Pawnography, featuring Richard Corey Harrison, is filmed in what shop and town?"
5a79131a554299148911f9e3," Also known as the Great Action, what other name did this event go by?"
5ab3f6935542992339550019,MadMaze was developed by Eric Goldberg as what type of game? 
5a81a84e5542990a1d231e4e,What year was the Argentine singer and actor who both directed and starred in El Tio Disparate born?
5ae5f1a8554299546bf82fd9,Where is the English punk rock band which Howard Devoto is the original singer of formed
5a8a2a5555429930ff3c0ccc,What is the current home arena of the NHL team Chris Summers plays for?
5adfeab455429942ec259b86,The star in a 1953 epic Metro-Goldwyn-Mayer film adaption of the play by Shakespeare had what occupation?
5abd56355542993062266c58,What singer who sang in church during her childhood did Stacy Barthe pen album tracks for?
5ab4e48655429942dd415f9c,What is the height of the tallest mountain from which the Glen River flows?
5a84bc5b5542991dd0999dc3,Who was the vizier of Ebla after one who had served king Ishar Damu for 17 years?
5a739b1955429978a71e9044,What company claims to manufacture one out of every three objects that provide a shelf life typically ranging from one to five years?
5a88abf75542997e5c09a6a1,"In what city was the second bowl game to air on all the ""big four"" television networks played?"
5ac3d90b5542995c82c4ac4b,What type of games are both Castle Risk and Elfenland?
5a7553a95542996c70cfaedf,What psychosis shares a name with an enemy fought by the protagonists in an animated show by Hasbro?
5adc035c554299438c868d04,What was the birth name of the ex-slave abolitionist featured in the art installation The Dinner Party?
5ae60d36554299546bf8303e,When did Belgium racer Stoffel Vandoorne win the Monaco GP2 Series round?
5ae5d63b5542996de7b71a2d,In what basketball position does the brother of Saulius Kuzminskas play?
5a802bf05542992bc0c4a6b7,Dru Decaro is the lead guitarist for the RnB artist who began creating music at what age?
5ac072ef554299294b218fe4,What country of origin does Jerry Barrett and Florence Nightingale have in common?
5add1aa65542990d50227de1,"Who was the director of the 2007 American fantasy comedy film in which the actor best known for playing Michael Scott on the the American version of ""The Office"" starred?"
5ade1c9e55429939a52fe822,Where did Henri Christophe and other slaves hold an uprising from 1791 to 1804 that led to the founding of a state which was both free from slavery and ruled by non-whites and former captives?
5ac313a0554299741d48a1b0,How many employees does the company that unveiled a deal to acquire IGATE have? 
5ae324775542994393b9e62f,Korea University College of Education is based in the city that ranks what in the world by terms of size?
5ade8bd955429975fa854f04,"What is the name of the genocidal mass slaughter of Tutsi Rwanda, in which Cyprian and Daphrose Rugamba were assassinated?"
5a84a1c85542992a431d1a7c,Who was the original female founder of the brewery that was purchased in 2006 by the largest brewery in the state of Maryland?
5abed7d75542990832d3a0f7,SR connector is based on the connector that is often used for what type of cable?
5a8f9dca55429918e830d295,"What role on ""Switched at Birth"" was played by the actor who is being replaced by Daniel Hall on ""The Young and the Restless""?"
5ae61351554299546bf83066,When did the Italian luxury fashion house which Daas has appeared in campaigns for brands like founded
5ae50c345542993aec5ec11f,What did Felix Salten originally title his most famous work?
5abcefc45542993a06baf9b4,"a cabinet-making firm was found which year, from Lancaster?"
5a8f97305542997ba9cb32e3,Ben Stein had a part in the 1994 superhero fantasy film directed by whom?
5ab5ceb65542997d4ad1f1e2,Tui Flower and Julia child were both known for what?
5ae7e8f55542994a481bbe06,Which fictional MI6 agent is a fictional character created by the British journalist and novelist Ian Fleming in 1952?
5a8c7ac2554299653c1aa08e,Black Journal is based on the real life events of what serial killer that  murdered three women in Correggio?
5a866b5b554299211dda2b23,Mick Chatterton's best season was in 1969 finishing 16th place for the year in the oldest established what?
5ae1a525554299234fd042a9,Which university Founded as a college in 1881 is Janet Beer the Vice-Chancellor of
5abb23035542992ccd8e7f22,Kenneth Arnold reported the first unidentified object sighting in what city and state in 1947?
5abce43855429959677d6b18,"Soundcloud rap has been used by which rapper from Lauderhill, Florida?"
5a8e07185542995085b37389,Private Music signed the drummer who was part of which English group?
5adf2fa35542993344016c11,Which of Jonny Craig and Pete Doherty has been a member of more bands ?
5a804e845542992bc0c4a6e9,The Greatest Event in Television History aired on the channel that was founded by whom?
5a78d06355429974737f78b4,The channel that has interviewed players such as the forward for the French national team is on what platform?
5ac3dfee554299204fd21eab,"The man known as the voice of ""Elgar"" voices the English character in what Manga inspired by Keitaro Arima?"
5add48465542992200553a80,What film directed by David Greene did Merrell Jackson play an apostle in?
5a7c917e5542990527d554d3,How many kilometers did Sabrina Mockenhaupt run when she set her best record?
5a7e6c725542991319bc94a4,"Which band was formed first, Fitz and The Tantrums or The Contortionist?"
5a84e9d35542994c784dda84,The Nike Mercurial Vapor is endorsed by a Stoke City football player who also plays for what national team?
5ac3126f5542995ef918c0e8," Is it correct to state that Tetrapanax is an evergreen shrub as opposed to Hippophae which is a genus of sea buckthorns, a deciduous shrub?"
5a81e04455429903bc27b9f9,What was the creator of the Moshulu Parkway known as?
5ab3d2b7554299233954ffb8,The king deposed in the Glorious Revolution of 1688 was supported by the grandson of what Viscount Barnewall?
5a8d1f015542994ba4e3dc08,The king of the Molossians and Epirus encamped between what two cities?
5adf8d275542993344016cfb,Who wrote the 1995 American action film starring a two-time consensus All-American?
5aba0c2655429955dce3edb7,A golfer born in 1993 participated in which tournament?
5a7cf4e355429907fabef062,What was Todd Boehly's former position at the firm where Mark Walter is the CEO?
5ab2be12554299295394686b,Who was the football manager that played in the Football League Cup in 1985 and managed to lead the Birmingham City Football Club's 103rd season to finish in the 18th position?
5a7cd5b05542990527d5553d,"What Northern Ireland town founded in 1620 is the birthplace of one of the final four contestants from the seventh UK series of ""The Apprentice""?"
5ae0818e55429924de1b70e9,Gleanntáin Ghlas' Ghaoth Dobhair is a song that can be heard in pubs licensed to serve what?
5adfb60655429942ec259b08,"Matilda of Chester, Countess of Huntingdon's father was the son of which woman?"
5ab5de535542992aa134a3b6,Are Alek Keshishian and Kirk Kerkorian both Armenian-American?
5ac2ffe7554299218029dbb3,The 22nd AVN Awards took place in what Nevada county?
5a8769475542993e715abf2b,The Old Ones are more powerful than which of the mightiest Gods?
5a78caa955429970f5fffd83,Which civilization instigated a war with Rome and significantly influenced the Latin language?
5a8790785542993e715abfac,What was the first name of the wife of the namesake of the high school located at 123 Coles Street in Jersey City?
5ab6bb575542995eadef0088,This radio programme that originally aired from October 1995 to April 2000 starred a critic working in what field?
5ac2cdaa554299657fa29070,Where are Neoregelia and Aloysia known to grow
5ae64ffd5542992ae0d162ce,"How many Golden Globe Awards did the artist who published the photo book ""In Mexico"" win?"
5a88a1e55542997e5c09a64d,What was the former name of the stadium where the OFC U-20 Championship was played in 1986?
5ac34994554299741d48a242,"What was the first air date that the CGI animated series that preceded ""Mixels""?  "
5ae382ee5542992e3233c430,The Prussian General Carl von Clausewitz is associated with what type of realism?
5a8810485542997e5c09a590,The Airport located next to the A13 handled how many passengers in 2016 ?
5ae7281c5542991e8301cb69,The fourth episode The Simpsons' seventh season has what kind of theme?
5a888d535542997e5c09a617,In what county is The Third Fitzwilliam Meetinghouse located?
5ae48c4e55429913cc204498,"What Mexican actress of film, television, and theatre was a protagonist in La Heredera?"
5a7e05635542995f4f40238f,Katherine Ann Dettwyler wasn't rehired after she commented on the death of the student who was arrested in North Korea in what month and year?
5ae3fec55542995dadf242a4,Roxie Hart starred the entertainer and comedic actor who had what nickname?
5add39c45542995b365faac5,Did the the Battle of Stones River occur before the Battle of Saipan?
5a90629855429916514e749e,What is one risk to Norway's financial reserve?
5a85e2775542994775f60680,"Just Before I Go stars an actress who plays what character in the series ""24""?"
5a8ece2e5542995085b37497,The Out of Control Tour began in an indoor arena above what?
5a7a749d5542994f819ef1e0,At what frequency an academic journal publishes which covers numerical and computational techniques to reduce any substantial losses or gains suffered by an individual or an organization?
5a7e075c5542995f4f4023a3,Metro West Ambulance serves event support for the building in Portland formerly known as what?
5abcfcf0554299114383a1b4,Where in the traditional West Riding of Lindsey is the Trolleybus Museum Located?
5a78ed6855429970f5fffdd9,What is the population of the town that gets it's water supply from Canobie Lake?
5a8be8215542995e66a47518,"What is the name of the company manged by Joseph Reiser based in Biel/Bienne, Switzerland?"
5a8f495c5542997ba9cb3220,Where is Hawthornden Castle located relative to a castle 9 miles south of Edinburgh?
5a7db62d5542997cc2c4747c,What German state was Karl Julius Perleb born in?
5ae5db98554299546bf82fa6,"Shane and Friends have interviewed an American YouTube personality who has two active YouTube channels, which have a combined total of how many views?"
5ab27587554299449642c8af,Who described the captain of the winners of the 1964-65 European Cup Winners Cup as the best defender he had ever played against ?
5ae22f4e5542996483e6492f," Underfist: Halloween Bash was going to be the setup for a new series spin-off but the contract expired with a cable and television station that was launched on October 1, 19962 by whom?"
5ab8c3c65542991b5579effd,How many albums did the company who released Tift Merritt's debut album release for Tif Merritt?
5a82d71555429966c78a6a94,Were the Tundra Mine and Negus Mine located in the same country?
5abccf6755429965836004ab,In what year was the British actress who starred in a film adaptation of a series of eight children's books written by P. L. Travers born?
5adcfc135542990d50227d87,The Legendary A&M Sessions contain five songs by the singer whose work was conducted with what band?
5a77c15f5542997042120b1c,"In the British experimental jazz band Polar Bear, who handles digital devices?"
5a9064c755429916514e74a6,What is the first name of Jack Benny Binion's father?
5ab43b755542991779162c21,What sports club based in Hamburg Germany had a Persian born football player who played for eight seasons?
5a8ccea555429941ae14deeb,What was the name of the alum by the Scorpions that contained one of their most famous songs written by Klaus Meine and Herman Rarebell?
5ab6390f5542995eadeeff7a,Where was the maker of Cougar bourbon whiskey headquartered before its acquisition by Anheuser-Busch InBev?
5ac0d981554299012d1db646, Who was the founder of a chain of supermarkets that is now headquartered on Nott Street in Schenectady?
5a7c716d55429935c91b51b3,Which swiss watch company was forced to merge by the swiss banks in 1983?
5a7cd0fd55429909bec76823,"Which band, Matthew Good Band or Switchfoot is still together?"
5ac2a55b55429921a00ab018,Who developed the jet fighters operated by the 41st Tactical Squadron of the Polish Air Force?
5ab8ca5d5542991b5579f005,What club does the footballer who surpassed David Beckham for the appearance record play for?
5ac559bd5542993e66e82328,Horse the blind is known for nintendocore which emerged from hardcore punk and what genre?
5a8e61165542995085b3741a,What is the architectural distinction of the hotel whose owner and chief developer is Frank Augustus Miller?
5abd05e655429965836004f1,What was the companion piece that Poe's brother published?
5a7fb1765542992e7d278d20,Why does the City of Boston get their christmas tree from Ainslee Glen Nova Scotia?
5a722c2255429971e9dc932c,"What type of development, currently existing in Pasay, is currently being considered for malls such as one in M.A. Roxas Avenue in Clark Freeport, Angeles City in Pampanga Philippines?"
5a7562045542992db947364f,"Which university was founded first, University of California, Berkeley or Saint Louis University?"
5ae6233c5542992ae0d1623e,What was Thomas Boutflower Bennet's role at The Collegiate School of St Peter?
5a7cb94f554299683c1c6353,What is the first two words of the fifth studio album of Joseph Edgar Foreman?
5ae17d6855429901ffe4aea7,Which radioshow did Frank Sinatra appear on the year he won an Academy Award?
5ae69fa755429908198fa66c,Jeff Bhasker won a Grammy Award for a song that was the fourth single from what studio album?
5ab56e085542992aa134a315,"In what year year was the believed subject of the Lenny Kravitz song ""Lady"" born?"
5a79305755429907847277dd,What prince is a claimant to the former throne of Italy and born in September 1943?
5a7b18d25542992d025e6768,Who distributed a American-Indian-Irish computer-animated comedy-adventure film starring an Irish actor known for playing Miles O'Brien?
5ab44cd555429942dd415f10,Rafael de Souza Pereira is a defensive midfielder for what organization that is the top level of the Mexican football league system?
5a7140585542994082a3e6fa,Seal Harris was born in what county?
5ae1f079554299234fd04343,Which county located in the commonwealth of Kentucky is Kentucky Route 393 (KY 393) a state highway in 
5ab4314955429942dd415ecd,Profile Lake is located at the foot of a mountain that is how many feet tall?
5ae3249555429928c423962f,"The Order of th elithuanian Grand Duke Gediminas features one of the earliest symbols of Lithuania, that was used by the Lithuanian Republic as a minor state symbol during what period?"
5ae226bd5542994d89d5b379,"When is the national league which the Manchester United is participating in, set to end in 2018?"
5ae0156455429942ec259c15,What is the name of the fashion label that the founder of the Faena Arts Center founded in 1985?
5a7b85c4554299294a54a9d7,What type of vehicle is the Blue Bird Wanderlodge which was manufactured in Georgia by the Blue Bird Corporation?
5a81d81e554299676cceb0f6,"Which car brand was one step above the brand started on November 3, 1911?"
5abee2df5542994516f4546a,"The director of American crime film, Secret of the Chateau, was known to work at which company?"
5ac42ae45542997ea680ca18,What genre of music is Adnan Sami noted for playing on the piano created through a trapezoid-shapped hammered dulcimer?
5ae618325542996de7b71b56,"Gerald Grosvenor, 6th Duke of Westminster was succeeded by the British aristocrat who is estimated to be worth how much?"
5a8fdd9c55429916514e73de,"In which year did this American rapper and actor, from Cleveland, Ohio, who guest-featured in the album ""Excuse My French"" first release a mixtape?"
5a8ac44055429970aeb70304,Which segment of If These Walls Could Talk did the Goddess of Pop direct?
5ab55a9b5542992aa134a2ba, Legends of the Fall was based on a novella by what poetry and fiction writer?
5a88c92d5542993b751ca84e,What breed of dog are the Basset Bleu de Gascogne and the Beagle?
5ab972485542996be20204f6,The Reverend Jesse Bushyhead was a member of a Cherokee faction led by a chief born in what year?
5adcaa7f5542990d50227cdb,How many chapters does Yōko Shōji's most famous manga have?
5a7933b255429907847277eb,"Which composer was also a teacher, Philip Glass or Franz Schreker? "
5ae30d4b55429928c42395cc,"Besides acting in things such as Home Free, what else did Marian Mercer do?"
5a7265815542990c210a411b,What is the call sign of the airline that operates the flight with United Express Flight 3411 incident?
5a8c5794554299240d9c2131,Are Willard Mack and Subhash Ghai both involved in film?
5a85ac1e5542997b5ce4001f,What is the alcohol content of the drink normally consumed alongside Rippchen?
5abc40835542993a06baf8ba,When was the peer-reviewed open access scientific journal established in which Milivoje Kostic Editor-in-Chief of the Thermodynamics section?
5a883afc5542994846c1ce48,What city is the band that recorded Renegade from?
5ae0b68e55429906c02daafb,"Who wrote the jukebox musical depicting the recording session between the ""King of Rock and Roll"" and 3 other famous musicians?"
5a7dacff5542991319bc93e0,To whom does the term Pietro Colonna Galatino is sometimes referred to as the inventor of refer?
5adf6f075542993344016c91,Where is the game which  High Rollers Casino is a type been played 
5a7be1ab5542997c3ec972a9,UFO Magazine covers what subject named for Charles Hoy Fort?
5a8753d95542994846c1cd63,Did John Updike and Tom Clancy both publish more than 15 bestselling novels?
5a794f8155429970f5fffe95,"Who was born first, Martin Degville or Richie Furay?"
5ab53bee554299637185c526,God Is Not Great is by a journalist which due to his actions made him what?
5ac1a5b45542991316484b8b,Are both Odds and Supergrass rock bands?
5a79edfe5542990198eaf006,Who is is known domestically for his humorous videos and stage performances and released his sixth studio album in 2012?
5a72a3c45542994cef4bc3ac,"What is the birth name of the woman that ""A Woman Called Moses"" is based on?"
5abfd3d65542994516f4550b,Are both Don Giovanni and Cardillac operas with three acts?
5ae39fb85542990afbd1e197,Do both Changle District and Longkou face water?
5ab7bf3f5542991d322237a8,Edoardo Soleri is playing on loan from which Italian football club?
5a837121554299123d8c2128,"Q1: Which mountain is located in China, Kirat Chuli or Kangpenqing?"
5ae616ce5542992663a4f259,What are the names of the co-directors of the psychological horror film starring Emily Browning and Elizabeth Banks?
5ae375955542990afbd1e15d,"what is the group called that Dianne Morgan and Joe Wilkinson a part of in the BBC comedy ""Two Episodes of Mash"""
