question_id,question_text
5ab809bb5542990e739ec7f9,Name a movie that David Thewlis has performed in after the premiere of Fargo?
5adfdef9554299025d62a36b,Where was the first governor after the The Missouri Compromise from?
5ab98e2b5542996be202054e,The person that William Flannery was an architect for entered the publishing business in what year?
5a8b058055429971feec4612,Holland Park is located next to the shopping center owned by which corporation?
5a824e0b554299676cceb254,Where is the origin of Tie Domi who was a player for the Maple Leafs?
5a8b051255429971feec460e,Henderson Executive Airport got its name in 1996 when it was purchased by Clark County to be used as a reliever airport for an airport named after what politican?
5ac235e355429951e9e684a2,What collaboration with DJ Muggs did Gary Grice participate do in 2005?
5ab32fc355429969a97a80fa,Was Vanderbilt University or Emory University founded first?
5a8e8d665542995085b3744e,What was the birth name of the start of Hwarang: The Poet Warrior Youth?
5ac4f7e955429924173fb523,The English chef known for his back-to-basics philosphy has a sister named what?
5aba5c625542994dbf0198f2,Who founded Methodism along with the man who was also part of the revival movement in England and the Great Awakening in the United States?
5a7f5e0455429969796c1a12,Spill.com gave their final review for a movie directed by who?
5a84afdc5542991dd0999d81,"What golf course, located in Fulton County, Georgia, saw Keegan Bradley win a championship?"
5ab48f245542990594ba9c66,Did both the Beaulieu Mine and Colomac Mine fall into bankruptcy?
5a875b755542996e4f308796,"The song ""Medicine"" by The 1975 appears in a film directed by what Danish filmmaker?"
5ab31fea554299194fa9356a,When was the second album by Jason Daunt's band released?
5a7503945542996c70cfae76,"Which Lithuanian-Canadian anthropologist, primatologist, conservationist, ethologist, and author was chosen by  Louis Leakey, along with Jane Goodall, Dian Fossey to study hominids in their natural environments?"
5ae60484554299546bf8301a,Which player for the Chicago American Gears held the record which George Harry Yardley III broke 
5ae80f73554299540e5a5722,The title of this Swedish-French crime television series in English refers to a natural phenomenon where the sun remains visible for what?
5ab5df4c5542997d4ad1f218,When was Ben McNiece played his debut  in the Anzac Day clash  against Collingwood at the Melbourne Cricket Ground?
5ae165aa5542997b2ef7d1d1,What is the genre of music shared by vocalists Barney Greenway and Jens Kidman?
5a8b027e55429950cd6afc45,"The song ""Only a Pawn in Their Game"" was based on a crime whose perpetrator was convicted in this year."
5a83938c5542993344746049,What is the date of the reissue of one of Rhihanna's album that features three newly recorded songs and a DVD showing exclusive behind-the-scenes footage of Rihanna's worldwide tour that was the second overall and first world concert tour by Rihanna?
5a7354e35542994cef4bc55b,What is the name of second extended play by the artists of the mini-abum Code#01?
5a72644b5542997f8278399a,What professional footballer who plays for Championship side Cardiff City was part of the 2009 Houphouët-Boigny stampede?
5a7c5de155429935c91b5179,Which American pro basketball player who won gold at the 2008 Summer Olympics was signed by the Utah Jazz during the 2005-05 offseason?
5a73672b5542991f29ee2de7,Who played for the 1983–84 New York Knicks season and also had a younger brother who played in the NBA during his career
5ac4e07e5542996feb3fe95c,"The Bragg–Gray cavity theory was developed by Louis Harold Gray, William Lawrence Bragg, and a man that was knighrted in what year?"
5a8aad0d5542992d82986f55,"What is the genre of the 1991 film that featured the song ""Breakin' the Rules"" ?"
5ac4db1d554299076e296e1a,who is a British physicist  and also a  British government's chief scientific adviser
5a80b35c5542992bc0c4a7b8,Sinimole Paulose's favorite events are the 800 metres and another event that has been a contest at the Summer Olympics begining in what year?
5ab2118055429970612095b8,Which actress worked closely withCharpes Lane? 
5a7b895c5542997c3ec97206,The head writer for which show also wrote a Simpsons' episode narrated by James Earl Jones?
5a72334755429971e9dc934c,"""Heartbreak Hurricane"" was recorded by which country artist, that also goes by the name Ricky Skaggs?"
5ab720685542993667793f44,What type of believer does Mir Jafar Baghirov and Joseph Stalin have in common?
5ae2c509554299492dc91c68,What reward did the founder of Chick-Fil-A receive?
5a8341c255429954d2e2ec6e,Thehickey  team that won the 1997 Calder Cup playoffs is based in what city?
5a887293554299206df2b273,From what island has Chryseobacterium frigidum isolated?
5a74bdce55429929fddd84e1,Who died last Vladimir Arnold or Georg Cantor?
5abd81ff5542993062266cb3,What do the Church of St. Mary of the Spring and Hagia Irene have in common?
5ade662155429975fa854ebd,What were the nicknames for the companion of Nuna?
5a90945755429933b8a2056c,"John Constantine Williams, Sr was cofounder of a Florida city located in what county?"
5a8335d95542993344745ff1,"Who appeared in the Olympics first, Piet Norval or Emilio Sánchez?"
5ac1a6a85542994ab5c67db6,Where are the offices of the weather service that serves the Kansas city which was named after an agreement between European Americans and the Osage Nation?
5a8b46925542995d1e6f133c,When was the singer of Miss Emily's Picture born?
5ae444b55542996836b02c63,When was the brewery founded which has The Stag Inn Hastings as a tied house ?
5a8ba45b554299240d9c2051,Creation Entertainment is located in a city with what estimated 2014 population?
5ab6b6fd5542995eadef006b,Which band has more members Music for Dead Birds or The Wolfhounds?
5ae3e1e95542994393b9e78b,"""I Wed Three Wives"" is an episode of a television series that ran on what network?"
5abc87a8554299114383a13e,"Which Indian film playback singer as well a devotional singer contributed to the film ""Baabul"" (2006) and Sukshinder Shinda's album ""Collaborations 3?"""
5ae37e6e5542992f92d822e0,Which countries forces fought in The Battle of Hürtgen Forest which was covered in the shooter video game Darkest Hour: Europe '44-'45?
5add6f975542992200553b18,"In what year did the brother-in-law of Ezzo, Count Palatine of Lotharingia, die?"
5ab2909a5542993be8fa994f,"Hairy Jeremy was a television show created in a style that, when it uses plasticine, is called what?"
5ae083b75542993d6555eb85,"Who was an actor actor in the film The Ladder of Lies and was born October 23, 1893?"
5ae6dd745542996d980e7ca0,"What novella was the basis of the movie that featured the song ""Wien, du Stadt meiner Träume"" by Rudolf Sieczyński?"
5a8dacf2554299068b959d91,"Which year did the band, who released ""Hooligan's Holiday,"" retire?"
5adcfdc555429947343537f4,What federal agency was founded in 1935 and maintains a list of wanted persons?
5a7a616355429941d65f25f7,The team that would become the Little Giants was located in the county seat of which Ohio county?
5ac4f12d55429924173fb4f6,Pravda and Stiffelio are both operas?
5ae1b53b5542997283cd2255,What Indian government tag was given to the handicraft known for making simple loose clothing worn over the shoulders?
5ae526c455429908b6326529,Where is the headquarters for the service broadcaster the show Tenko is on?
5a7e32905542991319bc943b,Jennifer Jones captained the gold medalists for Canada at the Sochi Winter Olympics in which event?
5a7133fa5542994082a3e660,What is the relation between current manager of Chinese club Tianjin Quanjian and Paolo Cannavaro?
5ae61ac355429929b0807ac6,H Pistorius & Co is part of the reason for the wealth of the family that includes which South African sprinter?
5a78c69e55429974737f787c,"Who was born first, Ronnie Radke or Dave Brockie?"
5a8b86645542997f31a41d62,"When was the actor in the CW show developed by Greg Berlanti who also appears in ""Gods and Generals"" born?"
5a807b44554299485f59860a,Who conceived the rapid transit system that Klemzig Interchange is a part of?
5ae3ffba5542995dadf242b2,Valais is known for the resort municipality in which district in Switzerland?
5a777fd655429949eeb29e93,"What person, known also as Jane Ryan, has a four lane highway in the Philippines name after her? "
5addc7e35542997545bbbdbe,"Which areas of the United States were still able to deny sames sex marriages after the case in which Edith ""Edie"" Windsor was the main plaintiff?"
5a7c22bb554299683c1c62d3,"Was California State University, Dominguez Hills founded before or after Pacific Lutheran University?"
5a74e9c255429974ef308c93,"The book translated as ""School of Religions"" was suggested to be written by whom?"
5a8dde01554299653c1aa159,"In the ""Star Trek"" franchise, DeForest Kelley portrayed a character aboard which starship? "
5abce1af554299114383a178,"What type of group beat Sheryl Crow's ""All I Wanna Do"" on the ""Billboard"" Hot 100? "
5a8257fa55429940e5e1a866,The most famous song of the last monarch of Hawaii was what?
5a72830e5542994cef4bc2f9,"Where is the company that distributed XXXTentacion's single ""Revenge"" based?"
5a7ecae055429934daa2fc6a,Are Nathalie Sarraute and Anchee Min both writers?
5adfa12c554299025d62a301,Has Entrepreneur had a longer lifespan than Optimize?
5ae5bcbd55429960a22e0324,When is the football club which Stan Spinks played for founded
5a899f4955429946c8d6e971,Who directed a 2009 comedy released by BBC Films?
5ae14def55429901ffe4ae4a,Do both Lee Tamahori and Robert Redford work as a director?
5adf21bc5542993344016bf4,Lost in Time includes the theme song for a French/Japanese anime series that was created by who?
5a77e9c055429949eeb29fa6,Which British-Mauritian model starred alongside Raj Babbar and Mahesh Manjrekar in a 2011 Indian romantic comedy film?
5ac19eb35542994ab5c67da3,What does the organization associated with Carl Wieland believe about anything other than the young earth view? 
5a7f89c75542994857a76775,"The terminology of algebraic geometry changed drastically with the introduction of the general methods, initiated by a mathematician of what nationality?"
5ab6a3a3554299710c8d1f0d,Grounded Vindaloop is an episode from an animated television series that had this many episodes in its eighteenth season?
5ac3295d5542995ef918c14d,"What role in the TV show ""Death in Paradise"" was played by the man who performed with Alexander Armstrong in the podcast ""Timeghost""?"
5add6b595542992200553b0c,"Where was the artist behind ""Shit"" born and raised?"
5ae212c9554299495565d9de,Which rebellion did Sir John Wedderburn and Charles Edward Stuart fight for that ended with defeat at the Battle of Culloden?
5adcf20f5542994ed6169c2c,"Who directed the Hindi remake of the Korean film that starred Uhm Jung-hwa, Kim Sang-kyung, and Song Young-Chang?"
5ae2ff2055429928c4239598,What was the first comic book written by the writer who had a series developed into a 2010 film with Bruce Willis and Morgan Freeman?
5ac55e835542993e66e82375,"Thomas Fitch defended John Henry Holliday when he was accused of killing men during the gunfight at the o.k. corral, when was that?"
5a7b9f1f554299294a54aa2a,"Which director was born more recently, Tony Kaye or Marc Webb?"
5ab596d95542992aa134a371,WHere are both Sanming and Jiutai District located?
5ae20427554299234fd04397,Sachem Central School District encompasses the CDPs that include the hamlet in which New York county?
5a7fa48c5542994857a7679a,"In addition to Syosset Central, Half Hollow Hills Central, and the school district that has Henry L. Grishman as its superintendent, what other school district is near Hauppauge Union Free School District?"
5ae720e9554299572ea54715,What was Sophia Dallas' husbands name who served under the 11th president of the United States?
5a84c01e5542991dd0999dd6,In which period the first King of Norway's son who was the king of Norway?
5abca6375542993a06baf946,"According to the 2010 census, what was the population of the city in which Andover USD 385 is located?"
5ae7f41c5542997ec2727701,"What is the alleged rank of the mafioso who ran the Chicago Outfit with John DiFronzo, Joseph Andriacchi, Angelo LaPietra and ames Marcello?"
5ac4fbe255429924173fb53b,"Name one of the Judges of Spring Baking Championship television series who was born on December 17, 1974 ?"
5ae455d45542996836b02c7b,Nicholas Pinnock stars as Jason Backland in a series direccted by who ?
5a8f13d55542997ba9cb31c9,Philip Savage served as Direcor of Player Personnel for the Baltimore Ravens under what general manager who was inducted into both the College and Pro Football Halls of Fame?
5a8ee7c95542990e94052bb1,What song originally released by an American rock band active in the late 1960's and early 1970's did The Reels do a cover of in 1986?
5abea7c25542990832d3a068,The State Theatre is part of a performing arts centre located in what Australian suburb?
5a7172105542994082a3e837,What film did Tom Wu appear in that also starred Jason Statham and Ray Liotta? 
5ac3c264554299204fd21e37,The Gap band was from what neighbor hood that was known as the black wall street?
5a7542425542996c70cfaecc,"Who was born first, Karen Joy Fowler or Bruce Chatwin?"
5a8e4e7855429917b4a5bd92,Are both Papa John's Pizza and Papa Gino's specialized in Pizza?
5ade89d855429975fa854ef7,"In 2008, who were the two actors stared along with a South Korean actor, singer, and model who won best actor in five prestigious award ceremonies."
5a7636fb55429976ec32bd79,Who was the wife of the president when William Bainbridge started his career?
5a81d1f0554299676cceb0ee,"Which part of Handel's Messiah covers the birth of a child who, according to the gospels of Luke and Matthew, was born in Bethlehem?"
5adfa22655429942ec259ac4,"How many total staff (including part-time, flexible, and fixed contract staff) does the broadcaster, who released HyperNormalisation, employ?"
5ac4f04e5542995c82c4ad81,In which of the largest surviving medieval old towns in Europe is the Vilnius Cathedral located?
5ab2d65e554299545a2cfabe,The standard that defines Svalbard and Jan Mayen is similar to what standard that originated in the United Nations Statistics Division?
5ab6c1da554299710c8d1f4c,What province is the city where Matts (Matti) Wiktor Hoikka was a blacksmith and politician?
5a76c98855429972597f13d0,Near what ocean does the highway carried by the Long-Allen bridge terminate near?
5ae537895542990ba0bbb234,Where does the city situated where Kellyville Ridge is located?
5abc00ff5542993f40c73c41,Which contest did the singer of the song Mama's Song win ?
5a8ac87d55429970aeb7031d,What brother of Stanley Alan Van Gundy is a color commentator for ESPN?
5adf123f5542995ec70e8f63,Who are the executive producer of the Adult Swim skit show that Odd Future had?
5aba9db7554299232ef4a361,From 2003 to 2008 Tom Holland was responsible for what  ?
5ae56a3f5542992663a4f1f4,What is the former name of the animal whose habitat the Réserve Naturelle Lomako Yokokala was established to protect?
5adf5e285542992d7e9f9323,"When was the judge born who made notable contributions to the trial of the man who tortured, raped, and murdered eight student nurses from South Chicago Community Hospital on the night of July 13-14, 1966?"
5a839cb9554299123d8c2169,"Who has released more studio albums, 10 Years or Edward Sharpe and the Magnetic Zeros?"
5ae04a2755429924de1b7091,Are Columbia University and University of Colorado both private universities? 
5ade02d05542997545bbbe0d,Shirley Breeden won her first Senate term in a narrow upset over the politician who was a member of what branch of the armed forces?
5abd001d5542993a06baf9f2,The Westchester Knicks are a basketball team in a minor league basketball organization that was known as what from 2001 to 2005?
5ae5a3bb55429960a22e0314," Srivariki Premalekha is a movie based on ""Premalekha"" which is what type of book that is a long, written work of narrative fiction?"
5a8ee3a755429917b4a5be02,College Humor is a 1933 American pre-Code musical comedy film that starred what American singer and actor who has a trademark warm bass-baritone voice?
5a74397055429974ef308bbe,which coach did the longest tenured active coach n both the NBA and all US major sports leagues replaced in 1996?
5a82360055429903bc27ba46,"This American is best known for his work on such Disney animated films as ""Beauty and the Beast"" and a 1996 American animated musical drama film whose plot centers on who?"
5ab94bc2554299743d22eacf,Bytham Castle is a castle in the civil parish of how many houses?
5ac131575542994d76dccdb6,Who was the recipient of a prize also given to a player for Chinese club Tianjin Quanjian?
5a75a76b5542992db9473697,Which animal-themed Disney classic film appeared first: That Darn Cat! or Perri?
5adc2ae5554299438c868d64,Are Yucca and Rodgersia both perennials?
5ab52bd1554299637185c4ee,Are TEC-1 and Dubna 48K are based on the same processor?
5abd2af955429933744ab74b,What movie did actress Irene Jacob complete before the American action crime thriller film directed by Stuart Bird?
5a8cefc155429941ae14df55,What is the english translation of the name of style of novel of which The Company is an example?
5a76334c5542994ccc918710,Where is the author of Killing Pablo: The Hunt for the World's Greatest Outlaw (2001) born?
5a8c5d3f554299585d9e3675,Which band formed first Cha Cha Cohen or Swervedriver?
5a88982155429938390d3f81,What year did the shopping centre on the street numbered B411 open in the space of in the retail space of the former William Whiteley Limited department store?
5ade3b925542992fa25da70a,What was the middle name of the pilot who was portrayed by Levon Helm in the film The Right Stuff ?
5ac23f98554299636651994b,The Companions were the first of what type of cavalry?
5a7cfb2755429907fabef084,What year did the director of The Quiet American die?
5ae471fa55429970de88d965,Where did this dish emerge in the late 1950s that is a long-standing tradition in New Jersey? 
5abec66b5542997ec76fd360,What do Josef Veltjens and Hermann Goering have in common?
5a8e5a635542990e94052ae4,"How many albums have been sold by the singer who released the 2002 single ""Sk8er Boi""?  "
5a80db5055429938b6142218,"Whos version of Dawn of the Dead did R.D. Reid act in, the original by Zack Snyder or the remake by George A. Romero?"
5ac308135542990b17b154f4,"Christopher I of Denmark succeeded his brother, who was king during what period?"
5add3aaa5542992ae4cec500,"What was the name of the country ran by the president who maintained the mercenary unit, White Legion? "
5a7622d75542994ccc9186f1,"Who was born earlier, Garry Marshall or Leni Riefenstahl?"
5a8f03855542997ba9cb3186,The Collection at RiverPark is anchored by Target and an American supermarket chain that features foods without what type of fat?
5a74be7a55429929fddd84e4,What is served shaken with ice and should not be mistaken with the name Margarita?
5a7bacf35542997c3ec9724b,"Who was born first, Jorge Amado or James Leo Herlihy?"
5ab93781554299131ca422c7,Which star in the Maltese Bippy died in 1987?
5a80abd15542996402f6a5e0,Jing Tian was known for her role in a movie directed by who?
5a7ca55b55429907fabeefe0,How big is the campus of the University that Ben Bahan is a professor at ?
5ab941c2554299743d22ea88,"What is the pen name of author Carolyn Janice Cherry, who wrote the Fortress Series?"
5add47bf5542992200553a7f,Are Robin Wilson and Adrienne Bailon of the same nationality? 
5abd13b655429924427fceea," Which singer, who released his debut solo album in 2012, served as producer for the EP Live at the Third Man by White Denim in 2011?"
5abffa095542990832d3a1de,What is the middle name of the actor who hosted the24th People's Choice Awards with  Reba McEntire ?
5a7c02c45542996dd594b880,"In which theater did Heidi Brunner, a Swiss opera singer, play the role as Annio? "
5a74512b55429974ef308bd5,Who published the film magazine that Peter Biskind was executive editor of from 1986 to 1996?
5ae22895554299495565da0c,The Battle of the Catalaunian Plains involved the king of the nomadic tribes of which peoples?
5ae1fd8a5542994d89d5b2ee,"Do the University of Florida and University of Texas System combine to have both a 2000 acre campus and over 216,000 students?"
5a8a6b625542996c9b8d5ed9,In which town was the amusement park that is operated by Britannia Jinky Jersey Ltd located where the first  Tomorrow's Parties Festival was held?.
5ae14cf05542990adbacf742,What is the nationality of the illustrator of Chaos Marauders?
5add23d05542994734353871,What is the primary duty of the Austrian Pinscher and the Maremma Sheepdog?
5a7f1ad155429934daa2fce2,Australian National Airways was founded by the person who made the first what in 1928?
5a7fb90655429969796c1b34,"What is the real name of the free jazz drummer on the album ""Center of the World""?"
5a886b7555429938390d3f4d,When did the party inspired by Cacareco begin in Canada?
5adbfffb5542994650320c39,The McKinley Tariff was framed by the representative who was later assassinated in what month?
5ab3abe9554299753aec597e,Where did the free agent quarterback acquired for the 2015 Buffalo Bills season play college football at?
5ae497595542995ad6573db7,What are both Stauntonia and Pimelea?
5a72a47d55429901807daf1f,Arundel Castle was damaged during a war between which two groups?
5ac05e035542992a796decf7,Michael Standing was long term friends with which professional midfielder from West Brom?
5ac1725c5542994d76dcce2c,What was the alternate slang name for the World War I era grenade that the egg grenade was less awkward than to handle?
5adec4695542992fa25da83a,The Collective for Living Cinema of Lower Manhattan featured work from what filmmaker also known as Denis Kaufman?
5a846c005542990548d0b2b3,"What phone series serves as the successor to phones officially unveiled at the ""Samsung Unpacked 2015"" event?"
5a7dbb295542990b8f503a4b,"Which Russian professional ice hockey player, known as the Magic Man, was the final recipient of the NHL Plus-Minus Award?"
5a7df1095542990b8f503afe,Who was born first out of  Thomas Carr and Joyce Wieland?
5ae5086d55429908b63264eb,What date was the movie originally supposed to be released that was delayed due to the unlawful distribution of private photographs of Edison Chen with various women?
5ae48aff5542996836b02cce,"When was George Harrison's second single from his album, that was made with rising conflicts with Warner Bros., released in the United States? "
5a7ca95b55429935c91b5287,"Who lived longer, American author Owen Wister or Canadian author Lucy Maud Montgomery? "
5ae7a2e255429952e35ea99e,"""You Are"" is a song from which Pearl Jam album dealing with the September 2001 terrorist attacks?"
5ab250b9554299722f9b4cd9,The scientists who discovered Tedatioxetine were from what international pharmaceutical company?
5add3fe05542992c1e3a2580,"What 1997 song was on the Garth Brooks album that debuted at #1 on the ""Billboard"" 200?"
5a87b6215542996e4f3088d6,Are Yoo-hoo and Faygo both carbonated drinks?
5ac2cb09554299657fa29066,What team did Travis Cortez Mays play on which currently compete in the Big 12 Conference.?
5ab3acc5554299233954ff7e,"Helen Margaret Lederer appeared on a BBC television sitcom created by Jennifer Saunders, that is based on what 1990 sketch?"
5ac3ba0455429939154138f2,Saturn AL-31 is an engine that powers the aircraft produced in what country?
5ab1d6545542997061209588,At what age did Cieli di Toscana's singer become blind?
5a7b3fc155429931da12ca3a,"Wexner Graduate Fellowships are given to students who show an ability of an individual to ""lead"" or guide who?"
5adc8cb45542994d58a2f651,What is the nationality of the most praised player in the 2002–03 Olympique de Marseille season?
5a82930655429966c78a6a5e,"Which season did the UCF Knights represent at an American metropolitan public research university in Orlando, Florida?"
5ae09ea05542993d6555ebc1,The Bachelor was based on what novel written by an Austrian author?
5a85ecf25542991dd0999ec6,"Who plays opposite the double Olivier Award-winning English actress in the 2000 TV film following the relationship between ""Carry On"" film actors Sid James and Barbara Windsor?"
5ab572ff5542992aa134a31b,"Who directed the film which starred Steve Cochran and the actor who played Sheriff Roy Coffee in ""Bonanza""?"
5a8e16a5554299068b959e58,"Rowland Salley's best-known tune is ""Killing the Blues"", which has been most recently covered by which American singer-songwriter active mainly in the outlaw country music and Southern rock genres?"
5a71380c5542994082a3e68b,What iron-hulled steamship designed by Theodore Timby was The Orleans County Monitor Newspaper named after? 
5ae794215542997ec27276a8,What was the given name of the singer who is most closely associated with The Dakotas ?
5adc3d7455429944faac248a,When did the event that led Marissa Kurtimah to flee her country of birth begin? 
5a75e3845542994ccc91864e,What award did Flossie Bailey receive that was named after the first female self-made millionaire in America?
5a794119554299029c4b5f3c,"Who was born first, Nellee Hooper or Baz Luhrmann?"
5abe250f5542991f661060ef,"Who stared as the ""father of the atomic bomb"" in a 1980 television miniseries?"
5a881cbb55429938390d3ee7,St. John of the Cross Episcopal Church has a rectory that was in a style that was a product of what earlier style?
5a80b9df5542992bc0c4a7ec,What was the nickname of Judy Lewis's father?
5a8c62f5554299585d9e367b,By what other names was the king known whose reign was the first included in the Year Books? 
5a74a62b55429916b01641a0,"Which astronaut, Jean-François Clervoy or Ulrich Walter, was born first?"
5ab463da5542990594ba9c0d,What comic book does Hershel Greene and Carl Grimes appear in as characters?
5ae7b40e5542994a481bbdbd,Summer Holiday starred what actor who won  a BAFTA in 1954>
5a8601f855429960ec39b5fd,Which St. Louis Rams season was the final full season played by the 2008 winner of the Heisman Trophy?
5ae8167b55429952e35eaa06,What 1876 battle featured the Other Magpie?
